{
  "kind": "experimental_sandbox_session",
  "version": "2026-06-21",
  "mode": "sandbox_experimental",
  "defaultEnabled": false,
  "cloudRequired": false,
  "authority": "metadata_only",
  "executionAllowed": false,
  "modeStatus": "checkpoint_ready",
  "userOptIn": {
    "origin": "user",
    "confirmedBy": "user",
    "confirmedAt": "2026-06-21T17:00:00Z",
    "disposableWorkspaceAcknowledged": true,
    "requestIdMintedBy": "gui",
    "optInLabel": "User enabled disposable sandbox preview"
  },
  "limits": {
    "maxSteps": 6,
    "maxTouchedFiles": 4,
    "maxPatchBytes": 12000,
    "maxRuntimeSeconds": 600,
    "workspaceRelativePaths": [
      "apps/gui/src/App.tsx",
      "docs/README.md"
    ]
  },
  "checkpoint": {
    "status": "verified",
    "checkpointId": "checkpoint-s41-c1",
    "createdAt": "2026-06-21T17:01:00Z",
    "verified": true,
    "fileCount": 2,
    "contentHash": "sha256:aaaaaaaaaaaaaaaaaaaaaaaaaaaaaaaaaaaaaaaaaaaaaaaaaaaaaaaaaaaaaaaa",
    "label": "Verified disposable workspace checkpoint"
  },
  "rollback": {
    "status": "planned",
    "planId": "rollback-plan-s41-c1",
    "planHash": "sha256:bbbbbbbbbbbbbbbbbbbbbbbbbbbbbbbbbbbbbbbbbbbbbbbbbbbbbbbbbbbbbbbb",
    "affectedFileCount": 2,
    "requiresUserConfirmation": true,
    "label": "Rollback plan prepared for review"
  },
  "summary": "Checkpoint is verified and rollback plan metadata is ready"
}
